{
  "id": "blackmagic-multiview-4-hd",
  "version": "1.0",
  "name": "MultiView 4 HD",
  "manufacturerId": "blackmagic",
  "orderCode": null,
  "sku": null,
  "gtin": null,
  "climateLoad": 6,
  "weight": 242,
  "width": 134,
  "height": 22,
  "depth": 92,
  "rackType": "NONE",
  "rackHeight": 0,
  "rackDepth": 0,
  "portTypes": [
    {
      "name": "POWER +6 to 36V",
      "connectorId": "BARREL_XX_f",
      "subinterfaceTypes": [
        {
          "name": "",
          "direction": "IN",
          "pinout": [],
          "compatibleSignalTypes": ["DC_POWER"],
          "addInfo": {
            "DC_POWER": {
              "minV": 6,
              "maxV": 36,
              "maxP": 6
            }
          }
        }
      ]
    },
    {
      "name": "USB-C",
      "connectorId": "USBC_f",
      "subinterfaceTypes": [
        {
          "name": "",
          "direction": "IN",
          "pinout": [],
          "compatibleSignalTypes": ["USB_2"],
          "addInfo": {}
        }
      ]
    },
    {
      "name": "SDI IN 1",
      "connectorId": "BNC_f",
      "subinterfaceTypes": [
        {
          "name": "",
          "direction": "IN",
          "pinout": [],
          "compatibleSignalTypes": ["SDI_SD_CU", "SDI_HD_CU", "SDI_3G_CU"],
          "addInfo": {}
        }
      ]
    },
    {
      "name": "SDI IN 2",
      "connectorId": "BNC_f",
      "subinterfaceTypes": [
        {
          "name": "",
          "direction": "IN",
          "pinout": [],
          "compatibleSignalTypes": ["SDI_SD_CU", "SDI_HD_CU", "SDI_3G_CU"],
          "addInfo": {}
        }
      ]
    },
    {
      "name": "SDI IN 3",
      "connectorId": "BNC_f",
      "subinterfaceTypes": [
        {
          "name": "",
          "direction": "IN",
          "pinout": [],
          "compatibleSignalTypes": ["SDI_SD_CU", "SDI_HD_CU", "SDI_3G_CU"],
          "addInfo": {}
        }
      ]
    },
    {
      "name": "SDI IN 4",
      "connectorId": "BNC_f",
      "subinterfaceTypes": [
        {
          "name": "",
          "direction": "IN",
          "pinout": [],
          "compatibleSignalTypes": ["SDI_SD_CU", "SDI_HD_CU", "SDI_3G_CU"],
          "addInfo": {}
        }
      ]
    },
    {
      "name": "SDI OUT",
      "connectorId": "BNC_f",
      "subinterfaceTypes": [
        {
          "name": "",
          "direction": "OUT",
          "pinout": [],
          "compatibleSignalTypes": ["SDI_HD_CU", "SDI_3G_CU"],
          "addInfo": {}
        }
      ]
    },
    {
      "name": "HDMI OUT",
      "connectorId": "HDMI_A_f",
      "subinterfaceTypes": [
        {
          "name": "",
          "direction": "OUT",
          "pinout": [],
          "compatibleSignalTypes": ["HDMI"],
          "addInfo": {}
        }
      ]
    }
  ],
  "moduleSlotTypes": []
}
