{
  "id": "lawo-edge-dc",
  "version": "1.0",
  "name": ".edge (DC)",
  "manufacturerId": "lawo",
  "orderCode": ".edge_frame+dc",
  "sku": "A00/20",
  "gtin": null,
  "climateLoad": 700,
  "weight": 8000,
  "width": 483,
  "height": 89,
  "depth": 412,
  "rackType": "19INCH",
  "rackHeight": 2,
  "rackDepth": 412,
  "portTypes": [
    {
      "name": "[PSU 1]",
      "connectorId": "SCREW_M5_m",
      "subinterfaceTypes": [
        {
          "name": "",
          "direction": "IN",
          "pinout": [],
          "compatibleSignalTypes": ["DC_POWER"],
          "addInfo": {
            "DC_POWER": {
              "minV": 48,
              "maxV": 60,
              "maxP": 700
            }
          }
        }
      ]
    },
    {
      "name": "[PSU 2]",
      "connectorId": "SCREW_M5_m",
      "subinterfaceTypes": [
        {
          "name": "",
          "direction": "IN",
          "pinout": [],
          "compatibleSignalTypes": ["DC_POWER"],
          "addInfo": {
            "DC_POWER": {
              "minV": 48,
              "maxV": 60,
              "maxP": 700
            }
          }
        }
      ]
    },
    {
      "name": "[⏚]",
      "connectorId": "SCREW_M5_m",
      "subinterfaceTypes": [
        {
          "name": "",
          "direction": "IN",
          "pinout": [],
          "compatibleSignalTypes": ["GND"],
          "addInfo": {}
        }
      ]
    }
  ],
  "moduleSlotTypes": [
    {
      "name": "Slot 1",
      "canSpan": false,
      "compatibleModuleSlotFormFactors": [],
      "compatibleModuleTypes": ["lawo-edge-gateway"],
      "incompatibleModuleTypes": []
    },
    {
      "name": "Slot 2",
      "canSpan": false,
      "compatibleModuleSlotFormFactors": [],
      "compatibleModuleTypes": ["lawo-edge-gateway"],
      "incompatibleModuleTypes": []
    },
    {
      "name": "Slot 3",
      "canSpan": false,
      "compatibleModuleSlotFormFactors": [],
      "compatibleModuleTypes": ["lawo-edge-gateway"],
      "incompatibleModuleTypes": []
    },
    {
      "name": "Slot 4",
      "canSpan": false,
      "compatibleModuleSlotFormFactors": [],
      "compatibleModuleTypes": ["lawo-edge-gateway"],
      "incompatibleModuleTypes": []
    }
  ]
}
