{
  "id": "blackmagic-audio-monitor-12g-g3",
  "version": "1.0",
  "name": "Audio Monitor 12G G3",
  "manufacturerId": "blackmagic",
  "orderCode": null,
  "sku": null,
  "gtin": null,
  "climateLoad": 55,
  "weight": 2600,
  "width": 482,
  "height": 44,
  "depth": 242,
  "rackType": "19INCH",
  "rackHeight": 1,
  "rackDepth": 225,
  "portTypes": [
    {
      "name": "[AC]",
      "connectorId": "C14_3p_m",
      "subinterfaceTypes": [
        {
          "name": "",
          "direction": "IN",
          "pinout": [],
          "compatibleSignalTypes": ["AC_POWER_PE"],
          "addInfo": {
            "AC_POWER_PE": {
              "minF": 50,
              "maxF": 60,
              "minV": 100,
              "maxV": 240,
              "maxP": 55
            }
          }
        }
      ]
    },
    {
      "name": "10G 2110 IP",
      "connectorId": "RJ45_f",
      "subinterfaceTypes": [
        {
          "name": "",
          "direction": "UP",
          "pinout": [],
          "compatibleSignalTypes": [
            "10BASE_T",
            "100BASE_TX",
            "1000BASE_T",
            "10GBASE_T"
          ],
          "addInfo": {}
        }
      ]
    },
    {
      "name": "USB",
      "connectorId": "USBC_f",
      "subinterfaceTypes": [
        {
          "name": "",
          "direction": "IN",
          "pinout": [],
          "compatibleSignalTypes": ["USB_2"],
          "addInfo": {}
        }
      ]
    },
    {
      "name": "12G SDI IN",
      "connectorId": "BNC_f",
      "subinterfaceTypes": [
        {
          "name": "",
          "direction": "IN",
          "pinout": [],
          "compatibleSignalTypes": [
            "SDI_SD_CU",
            "SDI_HD_CU",
            "SDI_3G_CU",
            "SDI_6G_CU",
            "SDI_12G_CU"
          ],
          "addInfo": {}
        }
      ]
    },
    {
      "name": "12G SDI OUT",
      "connectorId": "BNC_f",
      "subinterfaceTypes": [
        {
          "name": "",
          "direction": "OUT",
          "pinout": [],
          "compatibleSignalTypes": [
            "SDI_SD_CU",
            "SDI_HD_CU",
            "SDI_3G_CU",
            "SDI_6G_CU",
            "SDI_12G_CU"
          ],
          "addInfo": {}
        }
      ]
    },
    {
      "name": "HDMI 4K OUT",
      "connectorId": "HDMI_A_f",
      "subinterfaceTypes": [
        {
          "name": "",
          "direction": "OUT",
          "pinout": [],
          "compatibleSignalTypes": ["HDMI"],
          "addInfo": {}
        }
      ]
    },
    {
      "name": "AES/EBU IN",
      "connectorId": "XLR3p_f",
      "subinterfaceTypes": [
        {
          "name": "",
          "direction": "IN",
          "pinout": [],
          "compatibleSignalTypes": ["AES3"],
          "addInfo": {}
        }
      ]
    },
    {
      "name": "ANALOG AUDIO IN L",
      "connectorId": "XLR3p_f",
      "subinterfaceTypes": [
        {
          "name": "",
          "direction": "IN",
          "pinout": [],
          "compatibleSignalTypes": ["AUDIO_BAL_ANA"],
          "addInfo": {}
        }
      ]
    },
    {
      "name": "ANALOG AUDIO IN R",
      "connectorId": "XLR3p_f",
      "subinterfaceTypes": [
        {
          "name": "",
          "direction": "IN",
          "pinout": [],
          "compatibleSignalTypes": ["AUDIO_BAL_ANA"],
          "addInfo": {}
        }
      ]
    },
    {
      "name": "STEREO IN L",
      "connectorId": "RCA_f",
      "subinterfaceTypes": [
        {
          "name": "",
          "direction": "IN",
          "pinout": [],
          "compatibleSignalTypes": ["AUDIO_UNBAL_ANA"],
          "addInfo": {}
        }
      ]
    },
    {
      "name": "STEREO IN R",
      "connectorId": "RCA_f",
      "subinterfaceTypes": [
        {
          "name": "",
          "direction": "IN",
          "pinout": [],
          "compatibleSignalTypes": ["AUDIO_UNBAL_ANA"],
          "addInfo": {}
        }
      ]
    },
    {
      "name": "[Headphone]",
      "connectorId": "TRS_635_f",
      "subinterfaceTypes": [
        {
          "name": "",
          "direction": "OUT",
          "pinout": [],
          "compatibleSignalTypes": ["PHONES_ANA"],
          "addInfo": {}
        }
      ]
    }
  ],
  "moduleSlotTypes": []
}
