{
  "id": "blackmagic-micro-converter-hdmi-to-sdi-12g",
  "version": "1.0",
  "name": "Micro Converter HDMI to SDI 12G",
  "manufacturerId": "blackmagic",
  "orderCode": null,
  "sku": null,
  "gtin": null,
  "climateLoad": 4,
  "weight": 150,
  "width": 78,
  "height": 25,
  "depth": 46,
  "rackType": "NONE",
  "rackHeight": 0,
  "rackDepth": 0,
  "portTypes": [
    {
      "name": "USB POWER",
      "connectorId": "USBC_f",
      "subinterfaceTypes": [
        {
          "name": "",
          "direction": "IN",
          "pinout": [],
          "compatibleSignalTypes": ["USB_2"],
          "addInfo": {}
        }
      ]
    },
    {
      "name": "HDMI IN",
      "connectorId": "HDMI_A_f",
      "subinterfaceTypes": [
        {
          "name": "",
          "direction": "IN",
          "pinout": [],
          "compatibleSignalTypes": ["HDMI"],
          "addInfo": {}
        }
      ]
    },
    {
      "name": "SDI OUT",
      "connectorId": "BNC_f",
      "subinterfaceTypes": [
        {
          "name": "",
          "direction": "OUT",
          "pinout": [],
          "compatibleSignalTypes": [
            "SDI_SD_CU",
            "SDI_HD_CU",
            "SDI_3G_CU",
            "SDI_6G_CU",
            "SDI_12G_CU"
          ],
          "addInfo": {}
        }
      ]
    },
    {
      "name": "SDI OUT",
      "connectorId": "BNC_f",
      "subinterfaceTypes": [
        {
          "name": "",
          "direction": "OUT",
          "pinout": [],
          "compatibleSignalTypes": [
            "SDI_SD_CU",
            "SDI_HD_CU",
            "SDI_3G_CU",
            "SDI_6G_CU",
            "SDI_12G_CU"
          ],
          "addInfo": {}
        }
      ]
    }
  ],
  "moduleSlotTypes": []
}
