{
  "id": "blackmagic-mini-converter-analog-to-sdi",
  "version": "1.0",
  "name": "Mini Converter Analog to SDI",
  "manufacturerId": "blackmagic",
  "orderCode": null,
  "sku": null,
  "gtin": null,
  "climateLoad": 7,
  "weight": 236,
  "width": 124,
  "height": 23,
  "depth": 93,
  "rackType": "NONE",
  "rackHeight": 0,
  "rackDepth": 0,
  "portTypes": [
    {
      "name": "POWER +12V",
      "connectorId": "BARREL_XX_f",
      "subinterfaceTypes": [
        {
          "name": "",
          "direction": "IN",
          "pinout": [],
          "compatibleSignalTypes": ["DC_POWER"],
          "addInfo": {
            "DC_POWER": {
              "minV": 12,
              "maxV": 31,
              "maxP": 7
            }
          }
        }
      ]
    },
    {
      "name": "[USB]",
      "connectorId": "USB2.0B_MINI_f",
      "subinterfaceTypes": [
        {
          "name": "",
          "direction": "IN",
          "pinout": [],
          "compatibleSignalTypes": ["USB_2"],
          "addInfo": {}
        }
      ]
    },
    {
      "name": "SDI OUT",
      "connectorId": "BNC_f",
      "subinterfaceTypes": [
        {
          "name": "",
          "direction": "OUT",
          "pinout": [],
          "compatibleSignalTypes": ["SDI_SD_CU", "SDI_HD_CU"],
          "addInfo": {}
        }
      ]
    },
    {
      "name": "SDI OUT",
      "connectorId": "BNC_f",
      "subinterfaceTypes": [
        {
          "name": "",
          "direction": "OUT",
          "pinout": [],
          "compatibleSignalTypes": ["SDI_SD_CU", "SDI_HD_CU"],
          "addInfo": {}
        }
      ]
    },
    {
      "name": "Y or NTSC/PAL",
      "connectorId": "BNC_f",
      "subinterfaceTypes": [
        {
          "name": "",
          "direction": "IN",
          "pinout": [],
          "compatibleSignalTypes": ["Y", "CVBS"],
          "addInfo": {}
        }
      ]
    },
    {
      "name": "B-Y or S-VIDEO Y",
      "connectorId": "BNC_f",
      "subinterfaceTypes": [
        {
          "name": "",
          "direction": "IN",
          "pinout": [],
          "compatibleSignalTypes": ["PB", "S_VIDEO_Y"],
          "addInfo": {}
        }
      ]
    },
    {
      "name": "R-Y or S-VIDEO C",
      "connectorId": "BNC_f",
      "subinterfaceTypes": [
        {
          "name": "",
          "direction": "IN",
          "pinout": [],
          "compatibleSignalTypes": ["PR", "S_VIDEO_C"],
          "addInfo": {}
        }
      ]
    },
    {
      "name": "L - ANALOG or AES/EBU",
      "connectorId": "TRS_635_f",
      "subinterfaceTypes": [
        {
          "name": "",
          "direction": "IN",
          "pinout": [],
          "compatibleSignalTypes": ["AUDIO_BAL_ANA", "AES3"],
          "addInfo": {}
        }
      ]
    },
    {
      "name": "R - ANALOG",
      "connectorId": "TRS_635_f",
      "subinterfaceTypes": [
        {
          "name": "",
          "direction": "IN",
          "pinout": [],
          "compatibleSignalTypes": ["AUDIO_BAL_ANA"],
          "addInfo": {}
        }
      ]
    }
  ],
  "moduleSlotTypes": []
}
