{
  "id": "blackmagic-mini-converter-sdi-distribution",
  "version": "1.0",
  "name": "Mini Converter SDI Distribution",
  "manufacturerId": "blackmagic",
  "orderCode": null,
  "sku": null,
  "gtin": null,
  "climateLoad": 5,
  "weight": 240,
  "width": 123,
  "height": 23,
  "depth": 93,
  "rackType": "NONE",
  "rackHeight": 0,
  "rackDepth": 0,
  "portTypes": [
    {
      "name": "POWER +12V",
      "connectorId": "BARREL_XX_f",
      "subinterfaceTypes": [
        {
          "name": "",
          "direction": "IN",
          "pinout": [],
          "compatibleSignalTypes": ["DC_POWER"],
          "addInfo": {
            "DC_POWER": {
              "minV": 12,
              "maxV": 31,
              "maxP": 5
            }
          }
        }
      ]
    },
    {
      "name": "SDI IN",
      "connectorId": "BNC_f",
      "subinterfaceTypes": [
        {
          "name": "",
          "direction": "IN",
          "pinout": [],
          "compatibleSignalTypes": [
            "SDI_SD_CU",
            "SDI_HD_CU",
            "SDI_3G_CU",
            "DVB_ASI"
          ],
          "addInfo": {}
        }
      ]
    },
    {
      "name": "SDI OUT",
      "connectorId": "BNC_f",
      "subinterfaceTypes": [
        {
          "name": "",
          "direction": "OUT",
          "pinout": [],
          "compatibleSignalTypes": [
            "SDI_SD_CU",
            "SDI_HD_CU",
            "SDI_3G_CU",
            "DVB_ASI"
          ],
          "addInfo": {}
        }
      ]
    },
    {
      "name": "SDI OUT",
      "connectorId": "BNC_f",
      "subinterfaceTypes": [
        {
          "name": "",
          "direction": "OUT",
          "pinout": [],
          "compatibleSignalTypes": [
            "SDI_SD_CU",
            "SDI_HD_CU",
            "SDI_3G_CU",
            "DVB_ASI"
          ],
          "addInfo": {}
        }
      ]
    },
    {
      "name": "SDI OUT",
      "connectorId": "BNC_f",
      "subinterfaceTypes": [
        {
          "name": "",
          "direction": "OUT",
          "pinout": [],
          "compatibleSignalTypes": [
            "SDI_SD_CU",
            "SDI_HD_CU",
            "SDI_3G_CU",
            "DVB_ASI"
          ],
          "addInfo": {}
        }
      ]
    },
    {
      "name": "SDI OUT",
      "connectorId": "BNC_f",
      "subinterfaceTypes": [
        {
          "name": "",
          "direction": "OUT",
          "pinout": [],
          "compatibleSignalTypes": [
            "SDI_SD_CU",
            "SDI_HD_CU",
            "SDI_3G_CU",
            "DVB_ASI"
          ],
          "addInfo": {}
        }
      ]
    },
    {
      "name": "SDI OUT",
      "connectorId": "BNC_f",
      "subinterfaceTypes": [
        {
          "name": "",
          "direction": "OUT",
          "pinout": [],
          "compatibleSignalTypes": [
            "SDI_SD_CU",
            "SDI_HD_CU",
            "SDI_3G_CU",
            "DVB_ASI"
          ],
          "addInfo": {}
        }
      ]
    },
    {
      "name": "SDI OUT",
      "connectorId": "BNC_f",
      "subinterfaceTypes": [
        {
          "name": "",
          "direction": "OUT",
          "pinout": [],
          "compatibleSignalTypes": [
            "SDI_SD_CU",
            "SDI_HD_CU",
            "SDI_3G_CU",
            "DVB_ASI"
          ],
          "addInfo": {}
        }
      ]
    },
    {
      "name": "SDI OUT",
      "connectorId": "BNC_f",
      "subinterfaceTypes": [
        {
          "name": "",
          "direction": "OUT",
          "pinout": [],
          "compatibleSignalTypes": [
            "SDI_SD_CU",
            "SDI_HD_CU",
            "SDI_3G_CU",
            "DVB_ASI"
          ],
          "addInfo": {}
        }
      ]
    },
    {
      "name": "SDI OUT",
      "connectorId": "BNC_f",
      "subinterfaceTypes": [
        {
          "name": "",
          "direction": "OUT",
          "pinout": [],
          "compatibleSignalTypes": [
            "SDI_SD_CU",
            "SDI_HD_CU",
            "SDI_3G_CU",
            "DVB_ASI"
          ],
          "addInfo": {}
        }
      ]
    }
  ],
  "moduleSlotTypes": []
}
